[
  {
    "id": "snake",
    "slug": "뱀",
    "keyword": "뱀 꿈",
    "category": "animals",
    "title": "뱀 꿈 해몽 — 뱀이 나오는 꿈의 의미 총정리",
    "summary": "뱀 꿈은 대체로 재물과 변화를 뜻하는 길몽이지만, 뱀에게 물리거나 쫓기는 상황이면 경고의 의미가 강해진다.",
    "verdict": "mixed",
    "meaning": "뱀은 예로부터 재물, 지혜, 생명력을 상징해 왔다. 그래서 뱀이 나오는 꿈은 전통 해몽에서 손꼽히는 길몽 중 하나로, 특히 뱀이 집 안으로 들어오거나 품에 안기는 장면은 재물이 들어오거나 귀한 인연이 생길 징조로 본다.\n\n다만 뱀 꿈은 상황에 따라 해석이 크게 갈린다. 뱀이 나를 공격하거나 쫓아오는 꿈은 주변에 경계해야 할 사람이 있다는 경고이고, 뱀을 죽이는 꿈은 어려움을 극복하고 경쟁에서 이긴다는 뜻으로 풀이한다. 뱀의 색도 중요하다. 흰 뱀과 황금빛 뱀은 최고의 길몽으로, 검은 뱀은 심리적 불안이나 건강 주의 신호로 읽는다.\n\n심리학적으로는 뱀이 억눌린 욕망이나 두려움, 혹은 껍질을 벗듯 새로 태어나려는 변화의 욕구를 나타낸다고 본다. 최근에 큰 결정을 앞두고 있거나 인간관계에서 긴장을 느끼고 있다면, 꿈속 뱀은 그 감정이 형상화된 것일 수 있다.",
    "variants": [
      { "situation": "뱀에게 물리는 꿈", "verdict": "mixed", "meaning": "전통 해몽에서는 뜻밖의 재물이나 태몽으로 보는 길몽이다. 특히 손이나 발을 물리면 노력한 일에 결실이 온다고 풀이한다. 다만 물린 자리가 심하게 아프거나 독이 퍼지는 느낌이었다면 건강이나 인간관계를 점검하라는 경고로 읽는다." },
      { "situation": "뱀을 죽이는 꿈", "verdict": "good", "meaning": "방해하던 사람이나 골칫거리를 내 손으로 정리한다는 뜻이다. 경쟁이나 소송, 갈등에서 유리한 결과를 얻을 가능성이 크다. 단, 죽이고 나서 기분이 나빴다면 성과 뒤에 후회가 따를 수 있다." },
      { "situation": "뱀에게 쫓기는 꿈", "verdict": "bad", "meaning": "피하고 싶은 문제나 사람이 계속 따라붙는 상태를 보여준다. 미뤄 둔 일이나 불편한 관계를 정면으로 마주할 때가 됐다는 신호다. 도망치다 잡히지 않았다면 위기를 넘긴다는 뜻이기도 하다." },
      { "situation": "흰 뱀 꿈", "verdict": "good", "meaning": "뱀 꿈 가운데 가장 좋은 꿈으로 꼽힌다. 큰 재물, 귀한 인연, 혹은 태몽으로 해석하며, 특히 흰 뱀이 몸을 감거나 집으로 들어오면 가문에 좋은 일이 생긴다고 본다." },
      { "situation": "뱀이 집에 들어오는 꿈", "verdict": "good", "meaning": "재물과 복이 집안으로 들어온다는 대표적인 길몽이다. 사업이나 투자에서 좋은 소식이 있거나, 가족 중 누군가에게 경사가 생길 수 있다는 뜻으로 풀이한다." },
      { "situation": "뱀이 여러 마리 나오는 꿈", "verdict": "mixed", "meaning": "한 마리보다 기운이 강하다. 재물이 여러 곳에서 들어온다고도 보지만, 뱀들이 뒤엉켜 불쾌했다면 복잡한 인간관계나 소문에 휘말릴 수 있다는 뜻이다." }
    ],
    "related": ["dragon", "lizard", "worm", "animal-bite", "gold"],
    "tags": ["재물", "변화", "경고", "태몽"],
    "searchTerms": ["뱀꿈", "뱀 나오는 꿈", "뱀 해몽", "뱀꿈 해몽", "꿈에 뱀"]
  },
  {
    "id": "dog",
    "slug": "개",
    "keyword": "개 꿈",
    "category": "animals",
    "title": "개 꿈 해몽 — 충직한 인연인가 배신의 조짐인가",
    "summary": "개 꿈은 가까운 사람과의 관계를 비추는 거울로, 개의 태도가 우호적이었는지 사나웠는지에 따라 길흉이 갈린다.",
    "verdict": "mixed",
    "meaning": "개는 집을 지키고 주인을 따르는 짐승이라, 전통 해몽에서 개는 곧 나를 둘러싼 사람을 뜻했다. 꼬리를 흔들며 반기는 개는 나를 도와줄 조력자이고, 이빨을 드러내며 짖는 개는 겉으로는 친한 척하지만 속을 숨긴 사람으로 풀이한다.\n\n한편 개 꿈은 재물보다 인간관계의 온도를 알려주는 경우가 많다. 여러 마리가 몰려다니면 사람에 치이는 시기라는 뜻이고, 홀로 묶여 있는 개는 도움을 청하고 싶어도 말하지 못하는 처지를 비춘다. 사냥개처럼 훈련된 개가 따르는 장면은 아랫사람이나 후배 복이 있다는 신호로 본다.\n\n현대 심리학에서는 개를 충성심, 소속감, 보호받고 싶은 마음의 상징으로 읽는다. 반려견을 키우는 사람이라면 애착과 상실 불안이 그대로 꿈에 나타난 것일 수 있어, 상징을 과하게 해석하기보다 최근의 관계를 돌아보는 편이 낫다.",
    "variants": [
      {
        "situation": "개가 반갑게 따라오는 꿈",
        "verdict": "good",
        "meaning": "나를 도우려는 사람이 가까이 있다는 뜻으로 본다. 부탁하기 어려웠던 일이 뜻밖의 손길로 풀리거나, 오래 소원했던 사람에게서 연락이 오는 흐름을 예고한다."
      },
      {
        "situation": "개가 사납게 짖는 꿈",
        "verdict": "bad",
        "meaning": "주변에서 나를 향한 말이 오간다는 경고로 풀이한다. 특히 직장이나 모임에서 오해가 커지기 쉬운 시기이니, 말수를 줄이고 문서로 남기는 편이 안전하다."
      },
      {
        "situation": "개에게 물리는 꿈",
        "verdict": "mixed",
        "meaning": "믿었던 사람에게 서운한 일을 겪는다는 해석이 우세하나, 피가 나도록 물렸다면 오히려 뜻밖의 이득이 따른다고도 본다. 물린 뒤 감정이 어땠는지가 판단의 기준이 된다."
      },
      {
        "situation": "개가 죽는 꿈",
        "verdict": "bad",
        "meaning": "곁을 지켜 주던 관계가 끊기거나 의지하던 지지대가 사라지는 국면을 뜻한다. 다만 오래 앓던 개가 편안히 눈을 감는 장면이었다면 묵은 갈등이 정리되는 신호로 읽기도 한다."
      },
      {
        "situation": "흰 개가 나오는 꿈",
        "verdict": "good",
        "meaning": "귀인이 찾아온다는 길몽으로 꼽힌다. 흰 개가 집 마당에 들어와 자리를 잡으면 집안에 경사가 있거나 새 식구가 늘어난다는 뜻으로 전해진다."
      },
      {
        "situation": "개를 쓰다듬는 꿈",
        "verdict": "good",
        "meaning": "관계를 회복하고 싶은 마음이 드러난 장면이다. 실제로 화해의 계기가 생기거나, 스스로를 다독일 여유가 돌아온다는 뜻으로 풀이한다."
      }
    ],
    "related": [
      "puppy",
      "cat",
      "animal-bite",
      "friend",
      "wolf"
    ],
    "tags": [
      "인간관계",
      "경고",
      "심리"
    ],
    "searchTerms": [
      "개꿈",
      "개 나오는 꿈",
      "개 해몽",
      "개한테 물리는 꿈",
      "꿈에 개"
    ]
  },
  {
    "id": "puppy",
    "slug": "강아지",
    "keyword": "강아지 꿈",
    "category": "animals",
    "title": "강아지 꿈 해몽 — 새 인연과 돌봄의 신호",
    "summary": "강아지 꿈은 새로 시작되는 인연이나 아직 손이 많이 가는 일을 뜻하며, 태몽으로 풀이되는 경우도 적지 않다.",
    "verdict": "good",
    "meaning": "다 자란 개가 인간관계를 뜻한다면, 강아지는 아직 자라는 중인 무언가를 가리킨다. 옛 해몽에서는 갓 태어난 강아지를 품에 안는 꿈을 태몽으로 보았고, 자식이나 후배가 생기는 조짐으로도 읽었다.\n\n강아지가 여러 마리 뛰어노는 장면은 집안이 북적이고 활기가 도는 시기를 예고한다고 본다. 반대로 강아지가 병들어 축 늘어져 있으면 시작한 일에 손이 더 필요하다는 뜻으로, 방치하면 탈이 난다는 경고로 풀이한다. 강아지를 잃어버리고 찾아 헤매는 꿈은 애써 키우던 계획이 흔들리는 상황을 비춘다.\n\n심리적으로는 보살핌을 주고받고 싶은 욕구가 강아지의 모습을 빌려 나타난 것으로 해석한다. 최근 누군가를 챙기느라 지쳤거나, 반대로 기대고 싶은 마음이 컸다면 그 감정이 꿈의 온도를 결정한다.",
    "variants": [
      {
        "situation": "강아지를 품에 안는 꿈",
        "verdict": "good",
        "meaning": "전통적으로 태몽 혹은 귀한 인연을 얻는 꿈으로 본다. 새 일을 맡거나 아끼며 키울 대상이 생긴다는 뜻이며, 안았을 때 따뜻했다면 결과가 좋은 쪽으로 기운다."
      },
      {
        "situation": "강아지가 여러 마리 있는 꿈",
        "verdict": "good",
        "meaning": "가정이나 조직에 사람이 늘고 분위기가 살아난다는 해석이 많다. 다만 감당하기 어려울 만큼 많았다면 벌여 놓은 일이 과하다는 신호로도 읽는다."
      },
      {
        "situation": "강아지가 아픈 꿈",
        "verdict": "bad",
        "meaning": "시작 단계의 일이나 관계에 문제가 생겼음을 알린다. 초기에 손보면 회복되는 수준이라는 뜻이기도 하니, 미뤄 둔 점검을 서두르라는 조언으로 받아들이면 된다."
      },
      {
        "situation": "강아지를 잃어버리는 꿈",
        "verdict": "bad",
        "meaning": "공들여 키우던 계획이나 마음이 흩어질 수 있다는 경고다. 실제 손실보다는 방향을 놓친 불안이 반영된 경우가 많아, 우선순위를 다시 세우는 계기로 삼는 편이 낫다."
      },
      {
        "situation": "강아지가 따라다니는 꿈",
        "verdict": "neutral",
        "meaning": "누군가 나를 의지하고 있다는 뜻으로 풀이한다. 부담으로 느껴졌다면 책임이 과중하다는 신호이고, 귀엽게 느껴졌다면 관계가 순조롭게 자라는 중이라는 의미다."
      }
    ],
    "related": [
      "dog",
      "baby-animal",
      "baby",
      "cat",
      "child"
    ],
    "tags": [
      "가족",
      "태몽",
      "인간관계",
      "행운"
    ],
    "searchTerms": [
      "강아지꿈",
      "강아지 나오는 꿈",
      "강아지 해몽",
      "강아지꿈 태몽",
      "꿈에 강아지"
    ]
  },
  {
    "id": "cat",
    "slug": "고양이",
    "keyword": "고양이 꿈",
    "category": "animals",
    "title": "고양이 꿈 해몽 — 은밀한 사람과 예민한 직감",
    "summary": "고양이 꿈은 속내를 감춘 사람이나 날카로워진 직감을 뜻하며, 대체로 조심하라는 쪽으로 풀이한다.",
    "verdict": "mixed",
    "meaning": "고양이는 소리 없이 움직이고 좀처럼 속을 보이지 않는 동물이다. 그래서 옛 해몽에서는 고양이를 겉과 속이 다른 사람, 혹은 몰래 손해를 끼치는 존재로 보았다. 특히 고양이가 나를 노려보거나 할퀴는 꿈은 가까운 사이에서 배신이 나온다는 경고로 전해진다.\n\n반면 고양이가 무릎 위에서 얌전히 자거나 스스로 다가오는 장면은 나쁘게만 보지 않는다. 경계심 많은 존재가 마음을 열었다는 뜻이니, 어렵게 여기던 사람과 사이가 풀리거나 까다로운 일이 순조로워진다는 해석도 가능하다.\n\n심리학적으로 고양이는 독립성과 직관을 상징한다. 남에게 맞추느라 지친 사람일수록 고양이 꿈을 자주 꾼다고 보며, 혼자 있는 시간이 필요하다는 신호로 읽는다. 검은 고양이는 불길함보다 아직 인정하지 않은 자신의 어두운 면을 뜻하는 경우가 많다.",
    "variants": [
      {
        "situation": "고양이가 할퀴는 꿈",
        "verdict": "bad",
        "meaning": "믿던 사람에게서 상처를 받거나 뒷말에 휘말릴 수 있다는 경고로 본다. 특히 얼굴을 할퀴었다면 체면이 상하는 일이 생길 수 있으니 공개적인 언행을 조심하는 편이 좋다."
      },
      {
        "situation": "검은 고양이를 보는 꿈",
        "verdict": "mixed",
        "meaning": "불길한 징조로만 보지는 않는다. 감춰 둔 감정이나 아직 마주하지 못한 문제를 상징하며, 고양이가 조용히 지나갔다면 별일 없이 넘어간다는 뜻으로 풀이한다."
      },
      {
        "situation": "고양이가 품에 안기는 꿈",
        "verdict": "good",
        "meaning": "까다롭던 상대가 마음을 여는 흐름을 뜻한다. 협상이나 부탁이 통하고, 거리를 두던 사람과 자연스럽게 가까워지는 계기가 생긴다고 본다."
      },
      {
        "situation": "새끼 고양이를 돌보는 꿈",
        "verdict": "good",
        "meaning": "아직 여린 일을 맡아 키워 낸다는 의미다. 성과가 당장 눈에 보이지 않아도 꾸준히 손을 대면 결실이 온다는 격려의 꿈으로 읽는다."
      },
      {
        "situation": "고양이가 우는 소리를 듣는 꿈",
        "verdict": "bad",
        "meaning": "주변에 도움을 청하는 사람이 있거나, 스스로 눌러 온 감정이 한계에 이르렀다는 신호다. 몸이 보내는 피로 경고로 보고 휴식을 챙기라는 조언으로도 풀이한다."
      }
    ],
    "related": [
      "dog",
      "fox",
      "tiger",
      "stranger",
      "anxious"
    ],
    "tags": [
      "인간관계",
      "경고",
      "심리"
    ],
    "searchTerms": [
      "고양이꿈",
      "고양이 나오는 꿈",
      "고양이 해몽",
      "검은 고양이 꿈",
      "고양이한테 할퀴는 꿈"
    ]
  },
  {
    "id": "tiger",
    "slug": "호랑이",
    "keyword": "호랑이 꿈",
    "category": "animals",
    "title": "호랑이 꿈 해몽 — 권력과 태몽의 대표 상징",
    "summary": "호랑이 꿈은 큰 권세와 출세를 뜻하는 대표 길몽이자 아들 태몽으로 널리 전해지는 꿈이다.",
    "verdict": "good",
    "meaning": "산군이라 불리던 호랑이는 우리 해몽에서 가장 격이 높은 짐승에 속한다. 호랑이를 보거나 올라타는 꿈은 지위가 오르고 큰 조직을 이끌게 된다는 뜻으로 풀이해 왔으며, 임신부가 꾸면 기개 있는 자식을 얻는 태몽으로 여겼다.\n\n다만 호랑이는 다루기 어려운 기운이기도 하다. 호랑이에게 쫓기거나 물리는 꿈은 감당하기 벅찬 상대, 이를테면 상급자나 큰 경쟁자와 부딪히는 상황을 비춘다. 호랑이를 제압하거나 굴복시켰다면 그 어려움을 이겨 낸다는 뜻으로 도리어 크게 좋은 꿈이 된다.\n\n심리적으로 호랑이는 억눌린 공격성과 야망을 나타낸다. 오래 참아 온 사람일수록 호랑이가 사납게 등장하며, 이는 내 안의 힘을 쓸 자리를 찾으라는 요청으로 읽을 수 있다.",
    "variants": [
      {
        "situation": "호랑이를 타는 꿈",
        "verdict": "good",
        "meaning": "권한을 손에 쥐고 큰 판을 움직이게 된다는 최고급 길몽으로 꼽힌다. 승진이나 합격, 사업 확장처럼 위치가 달라지는 변화가 따른다고 본다."
      },
      {
        "situation": "호랑이에게 물리는 꿈",
        "verdict": "mixed",
        "meaning": "전통 해몽에서는 강한 태몽이나 뜻밖의 발탁으로 보지만, 공포가 컸다면 버거운 상대에게 눌리는 상황을 뜻한다. 물린 부위가 아프지 않았다면 좋은 쪽으로 기운다."
      },
      {
        "situation": "호랑이에게 쫓기는 꿈",
        "verdict": "bad",
        "meaning": "피할 수 없는 압박이 다가온다는 신호다. 상급자의 요구나 마감처럼 실체가 분명한 부담일 때가 많으며, 붙잡히지 않고 달아났다면 고비를 넘긴다는 뜻이다."
      },
      {
        "situation": "호랑이가 집으로 들어오는 꿈",
        "verdict": "good",
        "meaning": "큰 기운이 집안에 들어온다는 뜻으로, 가족 중 누군가의 경사나 태몽으로 자주 풀이한다. 호랑이가 얌전히 자리를 잡았다면 복이 오래간다고 본다."
      },
      {
        "situation": "새끼 호랑이를 안는 꿈",
        "verdict": "good",
        "meaning": "장차 크게 될 무언가를 품에 얻는다는 의미다. 태몽으로도 자주 해석하며, 사업이라면 지금은 작아 보여도 키울 가치가 있는 기회를 만난다는 뜻이다."
      }
    ],
    "related": [
      "lion",
      "dragon",
      "bear",
      "cat",
      "promotion"
    ],
    "tags": [
      "직장",
      "태몽",
      "행운",
      "변화"
    ],
    "searchTerms": [
      "호랑이꿈",
      "호랑이 나오는 꿈",
      "호랑이 해몽",
      "호랑이 태몽",
      "호랑이한테 물리는 꿈"
    ]
  },
  {
    "id": "lion",
    "slug": "사자",
    "keyword": "사자 꿈",
    "category": "animals",
    "title": "사자 꿈 해몽 — 권위와 정면 대결의 상징",
    "summary": "사자 꿈은 강한 권위나 실력자를 뜻하며, 사자를 대하는 나의 태도가 길흉을 가르는 열쇠가 된다.",
    "verdict": "mixed",